🎬 VOLLAUTOMATISCHER TEST - @manel_nicolau
==========================================
Video: https://www.tiktok.com/@manel_nicolau/video/7196765040433761542
Start: Sun Jul 13 05:04:28 UTC 2025

1. API Health Check...
✅ API läuft und ist bereit
Log Monitor PID: 2961102

2. Monitoring gestartet...

GPU Monitor in separatem Terminal:
watch -n 1 'nvidia-smi  < /dev/null |  grep -E "MiB|%|Processes"'

3. STARTE VOLLAUTOMATISCHE ANALYSE
===================================
Eingabe: NUR tiktok_url (kein video_path!)

API Call...
  % Total    % Received % Xferd  Average Speed   Time    Time     Time  Current
                                 Dload  Upload   Total   Spent    Left  Speed
  0     0    0     0    0     0      0      0 --:--:-- --:--:-- --:--:--     0100    81    0     0  100    81      0    403 --:--:-- --:--:-- --:--:--   402100    81    0     0  100    81      0     67  0:00:01  0:00:01 --:--:--    67100    81    0     0  100    81      0     36  0:00:02  0:00:02 --:--:--    36100    81    0     0  100    81      0     25  0:00:03  0:00:03 --:--:--    25100    81    0     0  100    81      0     19  0:00:04  0:00:04 --:--:--    19100    81    0     0  100    81      0     15  0:00:05  0:00:05 --:--:--     0100    81    0     0  100    81      0     13  0:00:06  0:00:06 --:--:--     0100    81    0     0  100    81      0     11  0:00:07  0:00:07 --:--:--     0100    81    0     0  100    81      0      9  0:00:09  0:00:08  0:00:01     0100    81    0     0  100    81      0      8  0:00:10  0:00:09  0:00:01     0100    81    0     0  100    81      0      7  0:00:11  0:00:10  0:00:01     0100    81    0     0  100    81      0      7  0:00:11  0:00:11 --:--:--     0100    81    0     0  100    81      0      6  0:00:13  0:00:12  0:00:01     0100    81    0     0  100    81      0      6  0:00:13  0:00:13 --:--:--     0100    81    0     0  100    81      0      5  0:00:16  0:00:14  0:00:02     0100    81    0     0  100    81      0      5  0:00:16  0:00:15  0:00:01     0100    81    0     0  100    81      0      4  0:00:20  0:00:16  0:00:04     0100    81    0     0  100    81      0      4  0:00:20  0:00:17  0:00:03     0100    81    0     0  100    81      0      4  0:00:20  0:00:18  0:00:02     0100    81    0     0  100    81      0      4  0:00:20  0:00:19  0:00:01     0100    81    0     0  100    81      0      4  0:00:20  0:00:20 --:--:--     0100    81    0     0  100    81      0      3  0:00:27  0:00:21  0:00:06     0100    81    0     0  100    81      0      3  0:00:27  0:00:22  0:00:05     0100    81    0     0  100    81      0      3  0:00:27  0:00:23  0:00:04     0100    81    0     0  100    81      0      3  0:00:27  0:00:24  0:00:03     0100    81    0     0  100    81      0      3  0:00:27  0:00:25  0:00:02     0100    81    0     0  100    81      0      3  0:00:27  0:00:26  0:00:01     0100    81    0     0  100    81      0      2  0:00:40  0:00:27  0:00:13     0100    81    0     0  100    81      0      2  0:00:40  0:00:28  0:00:12     0100    81    0     0  100    81      0      2  0:00:40  0:00:29  0:00:11     0100    81    0     0  100    81      0      2  0:00:40  0:00:30  0:00:10     0100    81    0     0  100    81      0      2  0:00:40  0:00:31  0:00:09     0100    81    0     0  100    81      0      2  0:00:40  0:00:32  0:00:08     0100    81    0     0  100    81      0      2  0:00:40  0:00:33  0:00:07     0100    81    0     0  100    81      0      2  0:00:40  0:00:34  0:00:06     0100    81    0     0  100    81      0      2  0:00:40  0:00:35  0:00:05     0100    81    0     0  100    81      0      2  0:00:40  0:00:36  0:00:04     0100    81    0     0  100    81      0      2  0:00:40  0:00:37  0:00:03     0100    81    0     0  100    81      0      2  0:00:40  0:00:38  0:00:02     0100    81    0     0  100    81      0      2  0:00:40  0:00:39  0:00:01     0100    81    0     0  100    81      0      2  0:00:40  0:00:40 --:--:--     0100    81    0     0  100    81      0      1  0:01:21  0:00:41  0:00:40     0100    81    0     0  100    81      0      1  0:01:21  0:00:42  0:00:39     0100    81    0     0  100    81      0      1  0:01:21  0:00:43  0:00:38     0100    81    0     0  100    81      0      1  0:01:21  0:00:44  0:00:37     0100    81    0     0  100    81      0      1  0:01:21  0:00:45  0:00:36     0100    81    0     0  100    81      0      1  0:01:21  0:00:46  0:00:35     0100    81    0     0  100    81      0      1  0:01:21  0:00:47  0:00:34     0100    81    0     0  100    81      0      1  0:01:21  0:00:48  0:00:33     0100    81    0     0  100    81      0      1  0:01:21  0:00:49  0:00:32     0100    81    0     0  100    81      0      1  0:01:21  0:00:50  0:00:31     0100    81    0     0  100    81      0      1  0:01:21  0:00:51  0:00:30     0100    81    0     0  100    81      0      1  0:01:21  0:00:52  0:00:29     0100    81    0     0  100    81      0      1  0:01:21  0:00:53  0:00:28     0100    81    0     0  100    81      0      1  0:01:21  0:00:54  0:00:27     0100    81    0     0  100    81      0      1  0:01:21  0:00:55  0:00:26     0100    81    0     0  100    81      0      1  0:01:21  0:00:56  0:00:25     0100    81    0     0  100    81      0      1  0:01:21  0:00:57  0:00:24     0100    81    0     0  100    81      0      1  0:01:21  0:00:58  0:00:23     0100    81    0     0  100    81      0      1  0:01:21  0:00:59  0:00:22     0100    81    0     0  100    81      0      1  0:01:21  0:01:00  0:00:21     0100    81    0     0  100    81      0      1  0:01:21  0:01:01  0:00:20     0100    81    0     0  100    81      0      1  0:01:21  0:01:02  0:00:19     0100    81    0     0  100    81      0      1  0:01:21  0:01:03  0:00:18     0100    81    0     0  100    81      0      1  0:01:21  0:01:04  0:00:17     0100    81    0     0  100    81      0      1  0:01:21  0:01:05  0:00:16     0100    81    0     0  100    81      0      1  0:01:21  0:01:06  0:00:15     0100    81    0     0  100    81      0      1  0:01:21  0:01:07  0:00:14     0100    81    0     0  100    81      0      1  0:01:21  0:01:08  0:00:13     0100    81    0     0  100    81      0      1  0:01:21  0:01:09  0:00:12     0100    81    0     0  100    81      0      1  0:01:21  0:01:10  0:00:11     0100    81    0     0  100    81      0      1  0:01:21  0:01:11  0:00:10     0100    81    0     0  100    81      0      1  0:01:21  0:01:12  0:00:09     0100    81    0     0  100    81      0      1  0:01:21  0:01:13  0:00:08     0100    81    0     0  100    81      0      1  0:01:21  0:01:14  0:00:07     0100    81    0     0  100    81      0      1  0:01:21  0:01:15  0:00:06     0100    81    0     0  100    81      0      1  0:01:21  0:01:16  0:00:05     0100    81    0     0  100    81      0      1  0:01:21  0:01:17  0:00:04     0100    81    0     0  100    81      0      1  0:01:21  0:01:18  0:00:03     0100    81    0     0  100    81      0      1  0:01:21  0:01:19  0:00:02     0100    81    0     0  100    81      0      1  0:01:21  0:01:20  0:00:01     0100    81    0     0    0    81      0      0 --:--:--  0:01:21 --:--:--     0100    81    0     0    0    81      0      0 --:--:--  0:01:22 --:--:--     0100    81    0     0    0    81      0      0 --:--:--  0:01:23 --:--:--     0100    81    0     0    0    81      0      0 --:--:--  0:01:24 --:--:--     0100    81    0     0    0    81      0      0 --:--:--  0:01:25 --:--:--     0100    81    0     0    0    81      0      0 --:--:--  0:01:26 --:--:--     0100    81    0     0    0    81      0      0 --:--:--  0:01:27 --:--:--     0100    81    0     0    0    81      0      0 --:--:--  0:01:28 --:--:--     0100    81    0     0    0    81      0      0 --:--:--  0:01:29 --:--:--     0100    81    0     0    0    81      0      0 --:--:--  0:01:30 --:--:--     0100    81    0     0    0    81      0      0 --:--:--  0:01:31 --:--:--     0100    81    0     0    0    81      0      0 --:--:--  0:01:32 --:--:--     0100    81    0     0    0    81      0      0 --:--:--  0:01:33 --:--:--     0100    81    0     0    0    81      0      0 --:--:--  0:01:34 --:--:--     0100    81    0     0    0    81      0      0 --:--:--  0:01:35 --:--:--     0100    81    0     0    0    81      0      0 --:--:--  0:01:36 --:--:--     0100    81    0     0    0    81      0      0 --:--:--  0:01:37 --:--:--     0100    81    0     0    0    81      0      0 --:--:--  0:01:38 --:--:--     0100    81    0     0    0    81      0      0 --:--:--  0:01:39 --:--:--     0100    81    0     0    0    81      0      0 --:--:--  0:01:40 --:--:--     0100    81    0     0    0    81      0      0 --:--:--  0:01:41 --:--:--     0100    81    0     0    0    81      0      0 --:--:--  0:01:42 --:--:--     0100    81    0     0    0    81      0      0 --:--:--  0:01:43 --:--:--     0100    81    0     0    0    81      0      0 --:--:--  0:01:44 --:--:--     0100    81    0     0    0    81      0      0 --:--:--  0:01:45 --:--:--     0100    81    0     0    0    81      0      0 --:--:--  0:01:46 --:--:--     0100    81    0     0    0    81      0      0 --:--:--  0:01:47 --:--:--     0100    81    0     0    0    81      0      0 --:--:--  0:01:48 --:--:--     0100    81    0     0    0    81      0      0 --:--:--  0:01:49 --:--:--     0100    81    0     0    0    81      0      0 --:--:--  0:01:50 --:--:--     0100    81    0     0    0    81      0      0 --:--:--  0:01:51 --:--:--     0100    81    0     0    0    81      0      0 --:--:--  0:01:52 --:--:--     0100    81    0     0    0    81      0      0 --:--:--  0:01:53 --:--:--     0100    81    0     0    0    81      0      0 --:--:--  0:01:54 --:--:--     0100    81    0     0    0    81      0      0 --:--:--  0:01:55 --:--:--     0100    81    0     0    0    81      0      0 --:--:--  0:01:56 --:--:--     0100    81    0     0    0    81      0      0 --:--:--  0:01:57 --:--:--     0100    81    0     0    0    81      0      0 --:--:--  0:01:58 --:--:--     0100    81    0     0    0    81      0      0 --:--:--  0:01:59 --:--:--     0100    81    0     0    0    81      0      0 --:--:--  0:02:00 --:--:--     0100    81    0     0    0    81      0      0 --:--:--  0:02:01 --:--:--     0100    81    0     0    0    81      0      0 --:--:--  0:02:02 --:--:--     0100    81    0     0    0    81      0      0 --:--:--  0:02:03 --:--:--     0100    81    0     0    0    81      0      0 --:--:--  0:02:04 --:--:--     0100    81    0     0    0    81      0      0 --:--:--  0:02:05 --:--:--     0100    81    0     0    0    81      0      0 --:--:--  0:02:06 --:--:--     0100    81    0     0    0    81      0      0 --:--:--  0:02:07 --:--:--     0100    81    0     0    0    81      0      0 --:--:--  0:02:08 --:--:--     0100    81    0     0    0    81      0      0 --:--:--  0:02:09 --:--:--     0100   376  100   295    0    81      2      0  0:02:27  0:02:09  0:00:18    71
{"status":"success","video_path":"/home/user/tiktok_videos/videos/7196765040433761542.mp4","processing_time":127.8434944152832,"successful_analyzers":18,"total_analyzers":18,"results_file":"/home/user/tiktok_production/results/7196765040433761542_multiprocess_20250713_051234.json","error":null}

HTTP Status: 200
Response Time: 129.439829s

Gesamtdauer: 129 Sekunden

4. AUTOMATISIERUNGS-CHECK
========================
✅ Automatischer Download erkannt
✅ Nur tiktok_url verwendet - VOLLAUTOMATISCH!

5. ANALYSE-ERGEBNISSE
====================
✅ Result-Datei: /home/user/tiktok_production/results/7196765040433761542_multiprocess_20250713_051234.json

 VALIDATING: 7196765040433761542_multiprocess_20250713_051234.json
============================================================

📊 Metadata Validation:
  ✅ duration: 30.65
  ❌ fps: MISSING
  ❌ frame_count: MISSING
  ✅ processing_time_seconds: 127.8434944152832
  ✅ reconstruction_score: 100.0

📋 Analyzer Results (18 total):
  ✅ qwen2_vl_temporal: 12 segments
  ✅ object_detection: 57 segments
  ✅ speech_transcription: 2 segments
  ✅ audio_analysis: 21 segments
  ✅ scene_segmentation: 31 segments

🎯 Object Detection:
  Total segments: 57
  Total objects: 200
  Sample: bed (0.93)

🎬 Qwen2-VL Quality:
  Segments: 12
  Avg description length: 460 chars
  Coverage: 36s of 31s video

 FINAL VALIDATION:
  Reconstruction Score: 100/100
  All critical analyzers present: YES

📊 PERFORMANCE METRIKEN:
==================================================
Video Duration: 30.6s
Processing Time: 127.8s
Realtime Factor: 4.17x
Successful Analyzers: 18/18
Reconstruction Score: 100.0/100

✅ TikTok URL in Metadata: https://www.tiktok.com/@manel_nicolau/video/719676...

 KEY ANALYZER RESULTS:
--------------------------------------------------
Text Overlay: 113 segments, 110 texts found
Object Detection: 57 segments, 29 object types
  Types: sports ball, laptop, dining table, clock, bed, bowl, cow, dog, baseball bat, hair drier
Speech Analysis: Pitch 92Hz
Qwen2-VL: 12 segments, avg 460 chars/segment

6. ZUSAMMENFASSUNG
=================
✅ TEST ERFOLGREICH - System ist vollautomatisch!
⚠️ Performance langsam (4.17x > 3.5x)

Test abgeschlossen: Sun Jul 13 05:14:43 UTC 2025

